{
  "Impact Summary": "{\"confirmed\":15,\"inferred\":1,\"potential\":12,\"services\":28,\"customers\":10,\"customersAtRisk\":5,\"subscribers\":19583,\"publicSafety\":1,\"publicSafetyAtRisk\":1,\"slaExposureUsd\":840,\"priorityReason\":\"public-safety service impacted\"}",
  "Detected At": "2026-09-27T20:31:33Z",
  "SLA Exposure USD": "840",
  "Services Affected": "16",
  "Mitigated At": "2026-09-27T20:35:30Z",
  "Probable Cause": "Physical break on fiber span FIB-MSP-STP-01: both terminating ends lost light within 0s — consistent with a fiber cut, not an equipment fault.",
  "Cause Confirmed By": "noc.borealis",
  "Probable Cause Confidence": "0.92",
  "Incident ID": "INC-20260927-230D",
  "State": "Closed",
  "Priority": "P1",
  "Customers Affected": "10",
  "Root Resource ID": "FIB-MSP-STP-01",
  "Network Recovered At": "2026-09-27T20:35:43Z",
  "Comms State": "Sent",
  "Cause Confirmed At": "2026-09-27T20:35:35Z",
  "Replay Batch": "demo-202609272031",
  "Tenant ID": "borealis",
  "Escalation Level": "2",
  "Region ID": "RGN-NC",
  "Correlation Group ID": "CG-20260927-4B6BB6",
  "Major Incident": "Yes",
  "Major Declared By": "noc.borealis",
  "Market ID": "MKT-MSP",
  "Closed At": "2026-09-27T20:38:27Z",
  "Resolved At": "2026-09-27T20:38:04Z",
  "Service Recovered At": "2026-09-27T20:38:23Z",
  "Observed Root Cause": "Backhoe cut at I-94 km 9.41 (unpermitted sound-wall footing work) — confirmed by field OTDR + photo",
  "Owner": "noc.borealis",
  "Title": "Fiber Span FIB-MSP-STP-01 down — 9 cell sites, 7 enterprise/wholesale services, 10 customers",
  "Next Update Due At": "2026-09-27T20:38:27Z",
  "Major Declared At": "2026-09-27T20:35:17Z",
  "Verification State": "Passed",
  "Acknowledged At": "2026-09-27T20:35:17Z",
  "Owner Team ID": "TEAM-TRANSPORT"
}